{"$schema":"https://json-schema.org/draft/2020-12/schema","type":"object","required":["copy_version","full_dob_supported_as_display_context","year_affects_selection","records"],"properties":{"copy_version":{"const":"KIP_REASON_COPY_V2_SALES_WEIGHTED"},"full_dob_supported_as_display_context":{"const":true},"year_affects_selection":{"const":false},"records":{"type":"array","minItems":32,"items":{"type":"object","required":["reason_code","chertog_id","themes","recommendation_template","why_it_fits_template"],"properties":{"reason_code":{"type":"string","pattern":"^[A-Z0-9_]+$"},"chertog_id":{"type":"string","pattern":"^[a-z_]+$"},"gender":{"enum":["male","female"]},"marketplace":{"enum":["ozon","wildberries"]},"themes":{"type":"array","minItems":2,"maxItems":4,"items":{"type":"string","minLength":1}},"recommendation_template":{"type":"string","minLength":1},"why_it_fits_template":{"type":"string","minLength":1}},"additionalProperties":false}}},"additionalProperties":false}
