{
  "copy_version": "KIP_REASON_COPY_V2_SALES_WEIGHTED",
  "full_dob_supported_as_display_context": true,
  "year_affects_selection": false,
  "records": [
    {
      "reason_code": "DEVA_MALE",
      "chertog_id": "deva",
      "gender": "male",
      "themes": [
        "жизненная сила",
        "развитие",
        "созидание",
        "стремление воплощать задуманное"
      ],
      "recommendation_template": "Мужчине рекомендуем оберег «{customer_label}».",
      "why_it_fits_template": "Его связывают с созидательным трудом, мастерством и умением создавать прочную основу, поэтому он соответствует деятельной стороне Чертога Девы."
    },
    {
      "reason_code": "DEVA_FEMALE",
      "chertog_id": "deva",
      "gender": "female",
      "themes": [
        "жизненная сила",
        "развитие",
        "созидание",
        "стремление воплощать задуманное"
      ],
      "recommendation_template": "Женщине рекомендуем оберег «{customer_label}».",
      "why_it_fits_template": "Жива считается покровительницей Чертога Девы, поэтому её символ является прямым соответствием этой дате."
    },
    {
      "reason_code": "VEPR_MALE",
      "chertog_id": "vepr",
      "gender": "male",
      "themes": [
        "внутренняя устойчивость",
        "собранность",
        "ответственность",
        "умение сохранять опору"
      ],
      "recommendation_template": "Рекомендуем оберег «{customer_label}».",
      "why_it_fits_template": "Его связывают с внутренним центром, равновесием и прочной опорой, поэтому по смыслу он соответствует этой линии Чертога Вепря."
    },
    {
      "reason_code": "VEPR_FEMALE",
      "chertog_id": "vepr",
      "gender": "female",
      "themes": [
        "внутренняя устойчивость",
        "собранность",
        "ответственность",
        "умение сохранять опору"
      ],
      "recommendation_template": "Рекомендуем оберег «{customer_label}».",
      "why_it_fits_template": "Его связывают с внутренним центром, равновесием и прочной опорой, поэтому по смыслу он соответствует этой линии Чертога Вепря."
    },
    {
      "reason_code": "SHCHUKA_MALE",
      "chertog_id": "shchuka",
      "gender": "male",
      "themes": [
        "продолжение рода",
        "забота о близких",
        "семейные связи",
        "преемственность"
      ],
      "recommendation_template": "Мужчине рекомендуем оберег «{customer_label}».",
      "why_it_fits_template": "Его связывают с родовой памятью, преемственностью поколений и ответственностью перед своей семьёй, поэтому смысл символа хорошо соответствует родовой линии Чертога Щуки."
    },
    {
      "reason_code": "SHCHUKA_FEMALE",
      "chertog_id": "shchuka",
      "gender": "female",
      "themes": [
        "продолжение рода",
        "забота о близких",
        "семейные связи",
        "преемственность"
      ],
      "recommendation_template": "Женщине рекомендуем оберег «{customer_label}».",
      "why_it_fits_template": "Его связывают с женской силой, семейным благополучием и сохранением домашнего очага."
    },
    {
      "reason_code": "LEBED_MALE",
      "chertog_id": "lebed",
      "gender": "male",
      "themes": [
        "гармония",
        "семья",
        "внутреннее равновесие",
        "связь с близкими"
      ],
      "recommendation_template": "Мужчине рекомендуем оберег «{customer_label}».",
      "why_it_fits_template": "Его связывают с родовой памятью, преемственностью поколений и ответственностью перед семьёй."
    },
    {
      "reason_code": "LEBED_FEMALE",
      "chertog_id": "lebed",
      "gender": "female",
      "themes": [
        "гармония",
        "семья",
        "внутреннее равновесие",
        "связь с близкими"
      ],
      "recommendation_template": "Женщине рекомендуем оберег «{customer_label}».",
      "why_it_fits_template": "Макошь считается покровительницей Чертога Лебедя и связана с судьбой, женской силой и домашней гармонией."
    },
    {
      "reason_code": "ZMEI_MALE",
      "chertog_id": "zmei",
      "gender": "male",
      "themes": [
        "огненная сила",
        "защита",
        "жизненная энергия"
      ],
      "recommendation_template": "Рекомендуем оберег «{customer_label}».",
      "why_it_fits_template": "Семаргл считается покровителем Чертога Змея, поэтому его символ напрямую соответствует этой дате."
    },
    {
      "reason_code": "ZMEI_FEMALE",
      "chertog_id": "zmei",
      "gender": "female",
      "themes": [
        "огненная сила",
        "защита",
        "жизненная энергия"
      ],
      "recommendation_template": "Рекомендуем оберег «{customer_label}».",
      "why_it_fits_template": "Семаргл считается покровителем Чертога Змея, поэтому его символ напрямую соответствует этой дате."
    },
    {
      "reason_code": "VORON_MALE_KOLYADNIK",
      "chertog_id": "voron",
      "gender": "male",
      "themes": [
        "мудрость",
        "перемены",
        "обновление",
        "дальнейший путь"
      ],
      "recommendation_template": "Мужчине рекомендуем оберег «{customer_label}».",
      "why_it_fits_template": "Колядник связан с образом Коляды, обновлением, движением вперёд и новым жизненным этапом."
    },
    {
      "reason_code": "VORON_FEMALE",
      "chertog_id": "voron",
      "gender": "female",
      "themes": [
        "мудрость",
        "перемены",
        "новый жизненный цикл",
        "дальнейший путь"
      ],
      "recommendation_template": "Рекомендуем оберег «{customer_label}».",
      "why_it_fits_template": "Его связывают с внутренним центром, равновесием и прочной опорой для прохождения перемен."
    },
    {
      "reason_code": "VORON_CHANGE_INNER_SUPPORT",
      "chertog_id": "voron",
      "gender": "male",
      "marketplace": "wildberries",
      "themes": [
        "мудрость",
        "перемены",
        "обновление",
        "дальнейший путь"
      ],
      "recommendation_template": "Мужчине рекомендуем оберег «{customer_label}».",
      "why_it_fits_template": "Его связывают с внутренней опорой, равновесием и устойчивым центром при прохождении перемен."
    },
    {
      "reason_code": "MEDVED_MALE",
      "chertog_id": "medved",
      "gender": "male",
      "themes": [
        "внутренняя сила",
        "стойкость",
        "ответственность",
        "защита близких"
      ],
      "recommendation_template": "Рекомендуем оберег «{customer_label}».",
      "why_it_fits_template": "Этот символ в текущем товарном исполнении перекликается с образом Чертога Медведя; его связывают с силой, уверенностью и защитой."
    },
    {
      "reason_code": "MEDVED_FEMALE",
      "chertog_id": "medved",
      "gender": "female",
      "themes": [
        "внутренняя сила",
        "стойкость",
        "ответственность",
        "защита близких"
      ],
      "recommendation_template": "Рекомендуем оберег «{customer_label}».",
      "why_it_fits_template": "Этот символ в текущем товарном исполнении перекликается с образом Чертога Медведя; его связывают с силой, уверенностью и защитой."
    },
    {
      "reason_code": "BUSEL_ROD_LINEAGE_DIRECT",
      "chertog_id": "busel",
      "gender": "male",
      "themes": [
        "род",
        "преемственность поколений",
        "семейная ответственность",
        "связь с предками"
      ],
      "recommendation_template": "Мужчине рекомендуем оберег «{customer_label}».",
      "why_it_fits_template": "Этот символ связывают с родовой памятью, преемственностью поколений, уважением к предкам и ответственностью перед своей семьёй, поэтому он особенно хорошо соответствует основным темам Чертога Бусла."
    },
    {
      "reason_code": "BUSEL_FEMALE",
      "chertog_id": "busel",
      "gender": "female",
      "themes": [
        "род",
        "преемственность поколений",
        "семейная ответственность",
        "связь с предками"
      ],
      "recommendation_template": "Женщине рекомендуем оберег «{customer_label}».",
      "why_it_fits_template": "Этот символ связывают с женской силой, семейным благополучием, гармонией между близкими и сохранением домашнего очага, поэтому он естественно продолжает семейно-родовую линию Чертога Бусла."
    },
    {
      "reason_code": "VOLK_MALE",
      "chertog_id": "volk",
      "gender": "male",
      "themes": [
        "самостоятельность",
        "внутренняя сила",
        "интуиция",
        "собственный путь"
      ],
      "recommendation_template": "Рекомендуем оберег «{customer_label}».",
      "why_it_fits_template": "Велес считается покровителем Чертога Волка, поэтому его символ наиболее непосредственно соответствует этой дате."
    },
    {
      "reason_code": "VOLK_FEMALE",
      "chertog_id": "volk",
      "gender": "female",
      "themes": [
        "самостоятельность",
        "внутренняя сила",
        "интуиция",
        "собственный путь"
      ],
      "recommendation_template": "Рекомендуем оберег «{customer_label}».",
      "why_it_fits_template": "Велес считается покровителем Чертога Волка, поэтому его символ наиболее непосредственно соответствует этой дате."
    },
    {
      "reason_code": "LISA_MALE",
      "chertog_id": "lisa",
      "gender": "male",
      "themes": [
        "проницательность",
        "гибкость",
        "внутренняя сила",
        "поиск выхода"
      ],
      "recommendation_template": "Мужчине рекомендуем оберег «{customer_label}».",
      "why_it_fits_template": "Его связывают с преодолением трудных периодов, внутренней стойкостью и способностью проходить перемены."
    },
    {
      "reason_code": "LISA_FEMALE",
      "chertog_id": "lisa",
      "gender": "female",
      "themes": [
        "интуиция",
        "гибкость",
        "внутренняя сила",
        "периоды перемен"
      ],
      "recommendation_template": "Женщине рекомендуем оберег «{customer_label}».",
      "why_it_fits_template": "Этот символ связан с темой внутренней стойкости, перемен и умения оставлять позади старое."
    },
    {
      "reason_code": "TUR_MALE",
      "chertog_id": "tur",
      "gender": "male",